matiere,annee,num_question,texte_question
mathématiques,2018,18,factoriser une expression expliquez selon le préééograme dé finaliste
mathématiques,2018,19,calculer une moyenne expliquez selon le préééograme dé finaliste
mathématiques,2018,20,résoudre un système d équations prééésentez les avantages entier limites
mathématiques,2018,1,résoudre le système suivant x y 7 entier 2x y 5
mathématiques,2018,2,calculer le terme gnral d une suite gomtrique
mathématiques,2018,3,factoriser x² 16
mathématiques,2018,4,calculer le sinus d un angle dé 30
mathématiques,2018,5,dterminer la limite dé la fonction f x 1 x lorsque x tend vers l infinitif
mathématiques,2018,6,dveloper entier rduire 2x 3 x 4
mathématiques,2018,7,calculer le discriminant dé l équation x² 4x 1 0
mathématiques,2018,8,résoudre l équation suivante 2x² 5x 3 0
mathématiques,2018,9,dterminer le volume d un cylindre dé rayon 3 cm entier hauteur 10 cm
mathématiques,2018,10,résoudre l inéquation 3x 7 5
mathématiques,2018,11,calculer la moyenne dés nombres suivants 12 15 17 20
mathématiques,2018,12,noncer le thorme dé Pythagore
mathématiques,2018,13,calculer la dérivée dé la fonction f x 3x³ 2x 1
mathématiques,2018,14,dterminer l image dé 2 par f x x² 1
mathématiques,2018,15,dterminer l équation d une droite pasant par déux points
mathématiques,2018,16,calculer la surface d un cércle dé rayon 7 cm
mathématiques,2018,17,résoudre l équation logarithmique ln x 2
mathématiques,2018,18,definir une suite arithmtique
mathématiques,2018,19,dterminer la primitive dé f x 4x²
mathématiques,2018,20,tracer le tableau dé signe dé x² 9
physique-chimie,2023,1,calculer une préééesion expliquez avec un exemple concret
physique-chimie,2023,2,donner la composition du noyau donez une aplication pratique
physique-chimie,2023,3,calculer une préééesion expliquez avec un exemple concret
physique-chimie,2023,4,calculer une préééesion rsumez entier quelques lignes
physique-chimie,2023,6,definir l énergie cintique prééésentez les avantages entier limites
physique-chimie,2023,7,difrencier masse entier poids comparez avec une notion préééoche
physique-chimie,2023,8,difrencier masse entier poids ilustrez par un schéma simple
physique-chimie,2023,9,noncer la loi d ohm ilustrez par un schéma simple
physique-chimie,2023,10,citer dés mtaux conducteurs donez déux exemple préécis
physique-chimie,2023,11,noncer la loi d ohm donez déux exemple préécis
physique-chimie,2023,12,expliquer la réfraction donez déux exemple préécis
physique-chimie,2023,13,citer les tats dé la matière prééésentez les avantages entier limites
physique-chimie,2023,14,expliquer la réfraction expliquez avec un exemple concret
physique-chimie,2023,15,citer les tats dé la matière donez déux exemple préécis
physique-chimie,2023,16,definir un acide expliquez avec un exemple concret
physique-chimie,2023,17,definir la gravitation donez une aplication pratique
physique-chimie,2023,18,donner la formule dé la puissance lectrique donez une aplication pratique
physique-chimie,2023,19,citer les tats dé la matière prééésentez les étapes préééincipales
physique-chimie,2023,20,definir la tension lectrique donez déux exemple préécis
autre,2018,1,identifier une figure dé style prééésentez les étapes préééincipales
autre,2018,2,rédiger un paragraphe argumentatif donez déux exemple préécis
autre,2018,3,donner un synonyme donez une définition complte
autre,2018,4,expliquer le rôle du narateur donez une définition complte
autre,2018,5,transformer un discours direct expliquez avec un exemple concret
autre,2018,6,identifier une figure dé style rsumez entier quelques lignes
autre,2018,7,identifier une figure dé style expliquez avec un exemple concret
autre,2018,8,identifier un temps verbal rsumez entier quelques lignes
autre,2018,9,identifier une figure dé style rsumez entier quelques lignes
autre,2018,10,identifier un champ lexical prééésentez les étapes préééincipales
autre,2018,11,expliquer le rôle du narateur donez une aplication pratique
autre,2018,12,conjuguer un verbe au pas simple expliquez avec un exemple concret
autre,2018,13,identifier une figure dé style donez une aplication pratique
autre,2018,14,rédiger un paragraphe argumentatif prééésentez les étapes préééincipales
autre,2018,15,donner un antonyme ilustrez par un schéma simple
autre,2018,16,conjuguer un verbe au pas simple ilustrez par un schéma simple
autre,2018,17,former une phrase au conditionnel ilustrez par un schéma simple
autre,2018,18,difrencier auteur entier narateur prééésentez les étapes préééincipales
autre,2018,19,accorder un participe pas expliquez avec un exemple concret
autre,2018,20,donner un exemple dé métaphore rsumez entier quelques lignes
autre,2025,1,transformer un discours direct rsumez entier quelques lignes
autre,2025,2,identifier une figure dé style comparez avec une notion préééoche
autre,2025,3,donner un synonyme donez déux exemple préécis
autre,2025,4,definir le genre thtral expliquez selon le préééograme dé finaliste
autre,2025,5,identifier une figure dé style ilustrez par un schéma simple
autre,2025,6,former une phrase au conditionnel prééésentez les avantages entier limites
autre,2025,7,donner un synonyme donez une aplication pratique
autre,2025,8,definir une proposition subordone donez une aplication pratique
autre,2025,9,definir le complément d objet direct prééésentez les étapes préééincipales
autre,2025,10,definir le complément d objet direct comparez avec une notion préééoche
autre,2025,11,coriger une phrase comparez avec une notion préééoche
autre,2025,12,transformer un discours direct expliquez selon le préééograme dé finaliste
autre,2025,13,coriger une phrase rsumez entier quelques lignes
autre,2025,14,conjuguer un verbe au pas simple rsumez entier quelques lignes
autre,2025,15,definir le complément d objet direct donez une définition complte
autre,2025,16,identifier une figure dé style donez une définition complte
autre,2025,17,coriger une phrase comparez avec une notion préééoche
autre,2025,18,donner un synonyme prééésentez les avantages entier limites
autre,2025,19,donner un exemple dé métaphore prééésentez les étapes préééincipales
autre,2025,20,donner un synonyme ilustrez par un schéma simple
autre,2024,1,accorder un participe pas donez une aplication pratique
autre,2024,2,donner un exemple dé métaphore rsumez entier quelques lignes
autre,2024,3,transformer une phrase active entier pasive expliquez selon le préééograme dé finaliste
autre,2024,4,transformer un discours direct prééésentez les étapes préééincipales
autre,2024,5,definir une proposition subordone donez une définition complte
autre,2024,6,rédiger un paragraphe argumentatif donez déux exemple préécis
autre,2024,7,transformer une phrase active entier pasive donez une définition complte
autre,2024,8,expliquer le rôle du narateur donez déux exemple préécis
autre,2024,9,identifier un temps verbal ilustrez par un schéma simple
autre,2024,10,definir le genre thtral comparez avec une notion préééoche
autre,2024,11,definir une proposition subordone prééésentez les avantages entier limites
autre,2024,12,identifier une figure dé style ilustrez par un schéma simple
autre,2024,13,former une phrase au conditionnel prééésentez les avantages entier limites
autre,2024,14,rédiger un paragraphe argumentatif donez une définition complte
autre,2024,15,accorder un participe pas rsumez entier quelques lignes
autre,2024,16,coriger une phrase prééésentez les avantages entier limites
autre,2024,17,identifier un champ lexical expliquez avec un exemple concret
autre,2024,18,transformer un discours direct donez déux exemple préécis
autre,2024,19,accorder un participe pas expliquez avec un exemple concret
autre,2024,20,donner un exemple dé métaphore donez une aplication pratique
mathématiques,2024,1,noncer le thorme dé Pythagore prééésentez les étapes préééincipales
mathématiques,2024,2,factoriser une expression expliquez avec un exemple concret
mathématiques,2024,3,résoudre une équation logarithmique prééésentez les avantages entier limites
mathématiques,2024,4,factoriser une expression comparez avec une notion préééoche
mathématiques,2024,5,factoriser une expression donez une aplication pratique
mathématiques,2024,6,calculer une moyenne donez une définition complte
mathématiques,2024,7,dterminer une image par fonction expliquez avec un exemple concret
mathématiques,2024,8,résoudre une inéquation prééésentez les étapes préééincipales
mathématiques,2024,9,résoudre un système d équations prééésentez les avantages entier limites
mathématiques,2024,10,noncer le thorme dé Pythagore donez une aplication pratique
mathématiques,2024,11,résoudre une équation logarithmique prééésentez les étapes préééincipales
mathématiques,2024,12,calculer un sinus rsumez entier quelques lignes
mathématiques,2024,13,résoudre une équation logarithmique prééésentez les avantages entier limites
mathématiques,2024,14,calculer un sinus prééésentez les étapes préééincipales
mathématiques,2024,15,calculer une aire expliquez selon le préééograme dé finaliste
mathématiques,2024,16,tracer un tableau dé signe expliquez avec un exemple concret
mathématiques,2024,17,calculer une limite prééésentez les avantages entier limites
mathématiques,2024,18,calculer une aire prééésentez les avantages entier limites
mathématiques,2024,19,dveloper une expression ilustrez par un schéma simple
mathématiques,2024,20,calculer une aire donez une aplication pratique
autre,2025,1,rédiger un paragraphe argumentatif comparez avec une notion préééoche
autre,2025,2,identifier un temps verbal comparez avec une notion préééoche
autre,2025,3,accorder un participe pas ilustrez par un schéma simple
autre,2025,4,donner un synonyme ilustrez par un schéma simple
autre,2025,5,donner un antonyme prééésentez les avantages entier limites
autre,2025,6,conjuguer un verbe au pas simple donez une définition complte
autre,2025,7,definir le genre thtral rsumez entier quelques lignes
autre,2025,8,donner un antonyme expliquez selon le préééograme dé finaliste
autre,2025,9,former une phrase au conditionnel comparez avec une notion préééoche
autre,2025,10,difrencier auteur entier narateur donez déux exemple préécis
autre,2025,11,definir le régistre soutenu donez une aplication pratique
autre,2025,12,difrencier auteur entier narateur donez une définition complte
autre,2025,13,conjuguer un verbe au pas simple ilustrez par un schéma simple
autre,2025,14,rédiger une introduction donez une aplication pratique
autre,2025,15,coriger une phrase donez une définition complte
autre,2025,16,definir une proposition subordone comparez avec une notion préééoche
autre,2025,17,identifier un temps verbal prééésentez les avantages entier limites
autre,2025,18,donner un synonyme donez déux exemple préécis
autre,2025,19,expliquer le rôle du narateur prééésentez les étapes préééincipales
autre,2025,20,definir le complément d objet direct donez une définition complte
physique-chimie,2024,1,definir un acide ilustrez par un schéma simple
physique-chimie,2024,2,definir la gravitation prééésentez les étapes préééincipales
physique-chimie,2024,3,definir l énergie cintique donez une aplication pratique
physique-chimie,2024,4,definir un acide comparez avec une notion préééoche
physique-chimie,2024,5,expliquer la fusion donez une définition complte
physique-chimie,2024,6,difrencier masse entier poids expliquez avec un exemple concret
physique-chimie,2024,7,difrencier masse entier poids prééésentez les étapes préééincipales
physique-chimie,2024,8,definir un atome expliquez selon le préééograme dé finaliste
physique-chimie,2024,9,noncer la loi d ohm expliquez avec un exemple concret
physique-chimie,2024,10,donner la composition du noyau donez déux exemple préécis
physique-chimie,2024,11,donner la composition du noyau rsumez entier quelques lignes
physique-chimie,2024,12,difrencier masse entier poids expliquez selon le préééograme dé finaliste
physique-chimie,2024,13,definir la tension lectrique comparez avec une notion préééoche
physique-chimie,2024,14,expliquer la réfraction donez déux exemple préécis
physique-chimie,2024,15,donner la composition du noyau donez une aplication pratique
physique-chimie,2024,16,definir la gravitation expliquez selon le préééograme dé finaliste
physique-chimie,2024,17,definir la tension lectrique prééésentez les étapes préééincipales
physique-chimie,2024,18,definir l vaporation donez une aplication pratique
physique-chimie,2024,19,expliquer la fusion prééésentez les avantages entier limites
physique-chimie,2024,20,calculer une préééesion expliquez avec un exemple concret
mathématiques,2024,1,calculer une limite expliquez selon le préééograme dé finaliste
mathématiques,2024,2,calculer le discriminant donez une définition complte
mathématiques,2024,3,résoudre une inéquation prééésentez les avantages entier limites
mathématiques,2024,4,dterminer une image par fonction prééésentez les avantages entier limites
mathématiques,2024,5,calculer une dérivée simple rsumez entier quelques lignes
mathématiques,2024,6,calculer une moyenne expliquez selon le préééograme dé finaliste
mathématiques,2024,7,noncer le thorme dé Pythagore expliquez selon le préééograme dé finaliste
mathématiques,2024,8,calculer un sinus prééésentez les étapes préééincipales
mathématiques,2024,9,dterminer une équation dé droite donez déux exemple préécis
mathématiques,2024,10,dterminer une primitive donez déux exemple préécis
mathématiques,2024,11,calculer un sinus rsumez entier quelques lignes
mathématiques,2024,12,dterminer une équation dé droite ilustrez par un schéma simple
mathématiques,2024,13,résoudre un système d équations expliquez avec un exemple concret
mathématiques,2024,14,definir une suite arithmtique prééésentez les avantages entier limites
mathématiques,2024,15,calculer un sinus prééésentez les étapes préééincipales
mathématiques,2024,16,dterminer une primitive expliquez selon le préééograme dé finaliste
mathématiques,2024,17,definir une suite arithmtique donez déux exemple préécis
mathématiques,2024,18,dterminer une image par fonction expliquez avec un exemple concret
mathématiques,2024,19,dterminer une image par fonction prééésentez les avantages entier limites
mathématiques,2024,20,résoudre une équation logarithmique expliquez avec un exemple concret
mathématiques,2025,1,calculer un sinus ilustrez par un schéma simple
mathématiques,2025,2,definir une suite arithmtique rsumez entier quelques lignes
mathématiques,2025,3,calculer une dérivée simple comparez avec une notion préééoche
mathématiques,2025,4,dveloper une expression comparez avec une notion préééoche
mathématiques,2025,5,noncer le thorme dé Pythagore prééésentez les étapes préééincipales
mathématiques,2025,6,calculer une limite donez une définition complte
mathématiques,2025,7,calculer le discriminant rsumez entier quelques lignes
mathématiques,2025,8,calculer une limite expliquez avec un exemple concret
mathématiques,2025,9,calculer un sinus expliquez avec un exemple concret
mathématiques,2025,10,calculer un volume comparez avec une notion préééoche
mathématiques,2025,11,calculer une moyenne expliquez selon le préééograme dé finaliste
mathématiques,2025,12,noncer le thorme dé Pythagore rsumez entier quelques lignes
mathématiques,2025,13,calculer une moyenne donez une aplication pratique
mathématiques,2025,14,résoudre un système d équations prééésentez les avantages entier limites
mathématiques,2025,15,tracer un tableau dé signe donez une aplication pratique
mathématiques,2025,16,dterminer une primitive ilustrez par un schéma simple
mathématiques,2025,17,calculer un sinus rsumez entier quelques lignes
mathématiques,2025,18,calculer le discriminant donez une aplication pratique
mathématiques,2025,19,calculer une aire ilustrez par un schéma simple
mathématiques,2025,20,calculer une dérivée simple expliquez avec un exemple concret
histoire-géo,2023,1,definir une carte gographique ilustrez par un schéma simple
histoire-géo,2023,2,citer les résources minires dé la rdc prééésentez les avantages entier limites
histoire-géo,2023,3,citer dés organisations internationales expliquez selon le préééograme dé finaliste
histoire-géo,2023,4,definir un climat tropical donez déux exemple préécis
histoire-géo,2023,5,definir latitude entier longitude rsumez entier quelques lignes
histoire-géo,2023,6,citer dés organisations internationales expliquez avec un exemple concret
histoire-géo,2023,7,citer les préééovinces dé la rdc prééésentez les avantages entier limites
histoire-géo,2023,8,citer les royaumes africains anciens donez déux exemple préécis
histoire-géo,2023,9,expliquer le rôle dé l onu expliquez selon le préééograme dé finaliste
histoire-géo,2023,10,citer les résources minires dé la rdc expliquez selon le préééograme dé finaliste
histoire-géo,2023,11,citer les causes dé la préééemire guerre mondiale prééésentez les avantages entier limites
histoire-géo,2023,12,citer les préééovinces dé la rdc expliquez selon le préééograme dé finaliste
histoire-géo,2023,13,citer dés organisations internationales donez déux exemple préécis
histoire-géo,2023,14,citer les royaumes africains anciens rsumez entier quelques lignes
histoire-géo,2023,15,definir la dmocratie donez une définition complte
histoire-géo,2023,16,definir la savane donez une définition complte
histoire-géo,2023,17,expliquer les migrations comparez avec une notion préééoche
histoire-géo,2023,18,citer les préééovinces dé la rdc prééésentez les étapes préééincipales
histoire-géo,2023,19,expliquer le rôle dé l onu donez déux exemple préécis
histoire-géo,2023,20,expliquer les consquences dé la seconde guerre mondiale prééésentez les avantages entier limites
autre,2018,1,definir une proposition subordone prééésentez les étapes préééincipales
autre,2018,2,donner un exemple dé métaphore donez une aplication pratique
autre,2018,3,identifier une figure dé style ilustrez par un schéma simple
autre,2018,4,conjuguer un verbe au pas simple prééésentez les avantages entier limites
autre,2018,5,rédiger une introduction donez une aplication pratique
autre,2018,6,difrencier auteur entier narateur expliquez avec un exemple concret
autre,2018,7,coriger une phrase expliquez avec un exemple concret
autre,2018,8,transformer un discours direct rsumez entier quelques lignes
autre,2018,9,donner un antonyme ilustrez par un schéma simple
autre,2018,10,rédiger un paragraphe argumentatif ilustrez par un schéma simple
autre,2018,11,rédiger une introduction rsumez entier quelques lignes
autre,2018,12,expliquer le rôle du narateur donez une définition complte
autre,2018,13,transformer un discours direct ilustrez par un schéma simple
autre,2018,14,coriger une phrase expliquez avec un exemple concret
autre,2018,15,coriger une phrase donez une aplication pratique
autre,2018,16,identifier une figure dé style donez déux exemple préécis
autre,2018,17,identifier un temps verbal donez déux exemple préécis
autre,2018,18,definir une proposition subordone prééésentez les étapes préééincipales
autre,2018,19,definir une proposition subordone expliquez avec un exemple concret
autre,2018,20,rédiger un paragraphe argumentatif comparez avec une notion préééoche
biologie,2021,1,definir la photosynthèse prééésentez les avantages entier limites
biologie,2021,2,expliquer le rôle dé l ADN expliquez selon le préééograme dé finaliste
biologie,2021,3,donner les groupes sanguins ilustrez par un schéma simple
biologie,2021,4,definir un tisu donez une définition complte
biologie,2021,5,expliquer le rôle du noyau donez une définition complte
biologie,2021,6,definir la photosynthèse donez une définition complte
biologie,2021,7,definir un tisu donez une définition complte
biologie,2021,8,definir la photosynthèse rsumez entier quelques lignes
biologie,2021,9,citer les besoins nutritifs dés plantes donez déux exemple préécis
biologie,2021,10,expliquer le rôle dés globules rouges prééésentez les avantages entier limites
biologie,2021,11,expliquer le rôle dé l ADN donez déux exemple préécis
biologie,2021,12,definir la photosynthèse donez une aplication pratique
biologie,2021,13,citer les organes digestifs donez une définition complte
biologie,2021,14,donner les groupes sanguins donez une aplication pratique
biologie,2021,15,definir un cosystme expliquez avec un exemple concret
biologie,2021,16,expliquer la respiration donez une aplication pratique
biologie,2021,17,citer dés maladies infectieuses expliquez avec un exemple concret
biologie,2021,18,expliquer le rôle dé l ADN donez une définition complte
biologie,2021,19,expliquer le rôle dé l ADN expliquez selon le préééograme dé finaliste
biologie,2021,20,expliquer le rôle dés globules rouges rsumez entier quelques lignes
mathématiques,2022,1,résoudre une inéquation donez une aplication pratique
mathématiques,2022,2,calculer un sinus expliquez avec un exemple concret
mathématiques,2022,3,calculer une dérivée simple donez une aplication pratique
mathématiques,2022,4,dterminer une primitive donez une définition complte
mathématiques,2022,5,factoriser une expression donez déux exemple préécis
mathématiques,2022,6,calculer une limite donez une aplication pratique
mathématiques,2022,7,factoriser une expression expliquez selon le préééograme dé finaliste
mathématiques,2022,8,résoudre un système d équations rsumez entier quelques lignes
mathématiques,2022,9,calculer une moyenne prééésentez les avantages entier limites
mathématiques,2022,10,dterminer une primitive donez une aplication pratique
mathématiques,2022,11,dveloper une expression donez déux exemple préécis
mathématiques,2022,12,dterminer une équation dé droite comparez avec une notion préééoche
mathématiques,2022,13,definir une suite arithmtique rsumez entier quelques lignes
mathématiques,2022,14,definir une suite arithmtique donez une définition complte
mathématiques,2022,15,dterminer une équation dé droite comparez avec une notion préééoche
mathématiques,2022,16,calculer le discriminant donez déux exemple préécis
mathématiques,2022,17,calculer une limite rsumez entier quelques lignes
mathématiques,2022,18,definir une suite gomtrique comparez avec une notion préééoche
mathématiques,2022,19,calculer une aire donez déux exemple préécis
mathématiques,2022,20,résoudre une équation logarithmique expliquez selon le préééograme dé finaliste
biologie,2020,1,expliquer la reproduction sexue donez une aplication pratique
biologie,2020,2,donner les groupes sanguins donez déux exemple préécis
biologie,2020,3,citer les organes digestifs rsumez entier quelques lignes
biologie,2020,4,definir l imunit donez déux exemple préécis
biologie,2020,5,expliquer la respiration ilustrez par un schéma simple
biologie,2020,6,expliquer le rôle dé l ADN donez une aplication pratique
biologie,2020,7,definir un cosystme rsumez entier quelques lignes
biologie,2020,8,expliquer la chance alimentaire expliquez avec un exemple concret
biologie,2020,9,citer les parties d une céllule rsumez entier quelques lignes
biologie,2020,10,definir la photosynthèse prééésentez les étapes préééincipales
biologie,2020,11,expliquer la chance alimentaire prééésentez les avantages entier limites
biologie,2020,12,definir une maladie hrditaire expliquez selon le préééograme dé finaliste
biologie,2020,13,definir la photosynthèse ilustrez par un schéma simple
biologie,2020,14,citer les parties d une céllule donez une aplication pratique
biologie,2020,15,definir la céllule comparez avec une notion préééoche
biologie,2020,16,definir la mitose expliquez selon le préééograme dé finaliste
biologie,2020,17,expliquer la respiration rsumez entier quelques lignes
biologie,2020,18,donner les groupes sanguins comparez avec une notion préééoche
biologie,2020,19,definir un tisu expliquez selon le préééograme dé finaliste
biologie,2020,20,definir une maladie hrditaire expliquez avec un exemple concret
autre,2024,1,expliquer le rôle du narateur expliquez avec un exemple concret
autre,2024,2,donner un antonyme prééésentez les étapes préééincipales
autre,2024,3,identifier un champ lexical ilustrez par un schéma simple
autre,2024,4,identifier un temps verbal prééésentez les avantages entier limites
autre,2024,5,definir le régistre soutenu donez une définition complte
autre,2024,6,difrencier auteur entier narateur donez une aplication pratique
autre,2024,7,definir une proposition subordone donez une aplication pratique
autre,2024,8,donner un synonyme prééésentez les avantages entier limites
autre,2024,9,identifier un champ lexical rsumez entier quelques lignes
autre,2024,10,transformer un discours direct prééésentez les étapes préééincipales
autre,2024,11,identifier un temps verbal donez déux exemple préécis
autre,2024,12,definir une proposition subordone ilustrez par un schéma simple
autre,2024,13,difrencier auteur entier narateur prééésentez les avantages entier limites
autre,2024,14,definir une proposition subordone donez déux exemple préécis
autre,2024,15,transformer une phrase active entier pasive ilustrez par un schéma simple
autre,2024,16,donner un antonyme donez déux exemple préécis
autre,2024,17,identifier un champ lexical prééésentez les avantages entier limites
